{
  "schema_version": "0.1",
  "registry_version": "0.1.0",
  "vault_aead_algorithm_id": "ALG-AES-256-GCM",
  "vault_key_bits": 256,
  "require_key_use_authorization": true,
  "require_user_authentication": true,
  "require_user_presence": true,
  "allow_plaintext_secret_at_rest": false,
  "allow_root_key_export": false,
  "allow_raw_root_key_cloud_sync": false,
  "require_key_rotation_on_auth_change": true,
  "require_vault_generation_monotonicity": true,
  "policy_id": "secret-token",
  "profile_ref": "secret-external-token@0.1.0",
  "mechanism_id": "SECRET-PKCS11-3.2",
  "require_non_exportable_root_key": true,
  "require_hardware_isolation": true,
  "require_attestation": false,
  "rollback_anchor_mode": "none",
  "require_rollback_protection": false,
  "software_secret_type": "none",
  "software_kdf_algorithm_id": null,
  "minimum_generated_secret_bits": null,
  "argon2_version": null,
  "argon2_memory_kib": null,
  "argon2_iterations": null,
  "argon2_parallelism": null,
  "argon2_salt_bytes": null,
  "argon2_output_bytes": null
}
