{
  "schema_version": "0.1",
  "registry_version": "0.1.0",
  "vault_aead_algorithm_id": "ALG-AES-256-GCM",
  "vault_key_bits": 256,
  "require_key_use_authorization": true,
  "require_user_authentication": false,
  "require_user_presence": false,
  "allow_plaintext_secret_at_rest": false,
  "allow_root_key_export": false,
  "allow_raw_root_key_cloud_sync": false,
  "require_key_rotation_on_auth_change": true,
  "require_vault_generation_monotonicity": true,
  "policy_id": "secret-software",
  "profile_ref": "secret-software-vault@0.1.0",
  "mechanism_id": "SECRET-SOFTWARE-VAULT",
  "require_non_exportable_root_key": false,
  "require_hardware_isolation": false,
  "require_attestation": false,
  "rollback_anchor_mode": "none",
  "require_rollback_protection": false,
  "software_secret_type": "generated-high-entropy",
  "software_kdf_algorithm_id": "ALG-ARGON2ID",
  "minimum_generated_secret_bits": 128,
  "argon2_version": "0x13",
  "argon2_memory_kib": 65536,
  "argon2_iterations": 3,
  "argon2_parallelism": 4,
  "argon2_salt_bytes": 16,
  "argon2_output_bytes": 32
}
